id,title,description,event_date,location,image_url
1,साप्ताहिक बाजार (आठवडी बाजार),"दोलायमान साप्ताहिक बाजार जिथे शेतकरी आणि व्यापारी ताजी उत्पादने, किराणा सामान आणि घरगुती वस्तू विकतात. स्थानिक समुदायासाठी एक मध्यवर्ती कार्यक्रम.",2025-11-02,"मुख्य बाजार चौक, श्रीगोंदा",/asset/SHRIGONDA.jpeg
2,शेख महंमद महाराज यात्रा,"श्री संत शेख महंमद महाराज यांच्या सन्मानार्थ वार्षिक यात्रा (तीर्थयात्रा). या कार्यक्रमात पालखी मिरवणूक, कीर्तन आणि मोठ्या यात्रेचा समावेश असतो.",2025-11-15,"श्री संत शेख महंमद महाराज मंदिर, श्रीगोंदा",/asset/SHRI SANT SHAIKH MOHAMMAD MAHARAJ.jpeg
3,दिवाळी पहाट,"दिवाळीच्या पहिल्या दिवशी सकाळी साजरा होणारा विशेष कार्यक्रम, ज्यामध्ये संगीत, सांस्कृतिक कार्यक्रम आणि प्रकाशाच्या उत्सवाचे स्वागत करण्यासाठी सामुदायिक मेळावे होतात.",2025-10-31,"श्रीगोंदा शहर केंद्र",/asset/images (7).jpeg
4,पेडगाव किल्ला हेरिटेज वॉक,"ऐतिहासिक पेडगाव किल्ल्याची (बहादूरगड) मार्गदर्शित सहल, त्याची मंदिरे, वास्तुकला आणि मराठा इतिहासातील धोरणात्मक महत्त्व शोधणे.",2025-11-22,"पेडगाव किल्ला, श्रीगोंदा",/asset/Dharmveer_ford.jpg
5,कृषी प्रदर्शन,"नवीनतम कृषी तंत्रज्ञान, बियाणे आणि खते प्रदर्शित करणारे शेतकऱ्यांसाठी प्रदर्शन. कार्यशाळा आणि प्रात्यक्षिकांचा समावेश.",2025-12-05,"कृषी उत्पन्न बाजार समिती, श्रीगोंदा",/asset/Dharmveer Gad pedgoan 1.jpg
6,सिद्धेश्वर मंदिर उत्सव,"मांडवगण येथील प्राचीन सिद्धेश्वर मंदिरातील वार्षिक उत्सव, ज्यामध्ये धार्मिक विधी आणि स्थानिक यात्रा असते.",2025-12-12,"सिद्धेश्वर मंदिर, मांडवगण",/asset/SHRIGONDA MANDIR.jpeg
